{
  "id": "scenario-3",
  "name": "The Mirror's Edge",
  "description": "Ten years — 40 quarters — with a stronger intelligence apparatus and an adversary whose build-up may be fear or may be appetite. The two readings demand opposite policies: guess wrong in either direction and your own posture helps write the war.",
  "turnCount": 40,
  "defaultSeed": 3141,
  "flavor": "The Verdant Dominion insists its build-up answers your forward posture, nothing more. Your own analysts are split on whether that is a genuine security dilemma or a cover story — and the difference decides whether restraint cools the strait or simply buys the Dominion time.",
  "seedTypePins": [
    { "seed": 3, "type": "SECURITY_SEEKER" }
  ],
  "opening": {
    "budget": 20,
    "politicalCapital": 12,
    "tracks": { "denial": 2, "punishment": 1, "intelligence": 2, "readiness": 2 },
    "priorArmingLevel": 2,
    "statusQuoIntegrity": 100
  },
  "beats": [
    { "eventId": "evt_budget_windfall", "minTurn": 4, "maxTurn": 8 },
    { "eventId": "evt_intel_deception", "minTurn": 8, "maxTurn": 14 },
    { "eventId": "evt_domestic_crisis", "minTurn": 14, "maxTurn": 20 },
    { "eventId": "evt_econ_shock", "minTurn": 20, "maxTurn": 28 }
  ],
  "tuning": {
    "budgetIncome": 6,
    "pcRegenPerTurn": 2,
    "pcCap": 20,
    "decayPerTurn": 0.1,
    "concessionSalamiThreshold": 3,
    "warThresholdConsecutiveTurns": 2,
    "honoredTestPC": 2,
    "pivotSubSeeds": 5,
    "maxPivots": 6,
    "trackThreatDeltas": { "denial": 0.01, "punishment": 0.06, "intelligence": 0.0, "readiness": 0.02 },
    "trackLeadTimeReadinessBonus": 0.15,
    "intelSigmaLevel0": 0.22,
    "intelSigmaLevel10": 0.05
  },
  "scoring": {
    "outcomeBands": [
      { "minOutcome": 80, "label": "Deterrence Achieved", "points": 100 },
      { "minOutcome": 55, "label": "Costly Stability", "points": 75 },
      { "minOutcome": 30, "label": "Strained Outcome", "points": 50 },
      { "minOutcome": 0, "label": "Strategic Failure", "points": 20 }
    ],
    "weights": {
      "outcome": 0.35,
      "robustness": 0.25,
      "diagnosis": 0.2,
      "credibility": 0.1,
      "efficiency": 0.1
    }
  }
}
